Title,URL,Idx
Who Would Be Barred by Trump's Latest Immigration Ban - The New ...,https://www.nytimes.com/interactive/2017/03/06/us/politics/trump-travel-ban-groups.html?mcubz=0,0
Ruling on Trump's Second Travel Ban - The New York Times,https://www.nytimes.com/interactive/2017/03/15/us/politics/document-Order.html?mcubz=0,0
Read the Court of Appeals for the Ninth Circuit's Ruling on Trump's ...,https://www.nytimes.com/interactive/2017/06/12/us/politics/document-Read-the-Ninth-Court-of-Appeals-Ruling-on-Trump.html?mcubz=0,0
The Supreme Court Partially Allowed Trump's Travel Ban. Who Is Still ...,https://www.nytimes.com/interactive/2017/06/29/us/politics/supreme-court-trump-travel-ban.html?mcubz=0,0
Companies Challenging (or Silent on) Trump's Immigration Ban,https://www.nytimes.com/interactive/2017/business/trump-immigration-ban-company-reaction.html?mcubz=0,0
Muslim in Trump's America - NYTimes.com,https://www.nytimes.com/interactive/projects/cp/opinion/election-night-2016/muslim-in-trumps-america?mcubz=0,0
President Trump's Agenda - NYTimes.com - The New York Times,https://www.nytimes.com/interactive/projects/cp/opinion/election-night-2016/president-trumps-agenda?mcubz=0,0
Stop Shaming Trump Supporters - NYTimes.com,https://www.nytimes.com/interactive/projects/cp/opinion/election-night-2016/stop-shaming-trump-supporters?mcubz=0,0
"Islam, Extremism and Civil Liberties - Room for Debate - NYTimes.com",https://www.nytimes.com/roomfordebate/2016/11/18/islam-extremism-and-civil-liberties/a-commission-on-radical-islam-could-lead-to-a-new-mccarthy-era,0
