Title,URL,Idx
Sally Yates Tells Harvard Students Why She Defied Trump - NYTimes ...,http://www.nytimes.com/2017/05/24/us/sally-yates-trump-travel-ban-harvard-law.html?mcubz=0,0
Iranian actress planned to boycott Oscars over 'racist' suspension of ...,http://nytlive.nytimes.com/womenintheworld/2017/01/27/iranian-actress-to-boycott-oscars-over-racist-plan-to-suspend-immigration-from-muslim-countries/?mcubz=0,0
4 women judges led the way in opposing Donald Trump's travel ban ...,http://nytlive.nytimes.com/womenintheworld/2017/01/30/4-women-judges-led-the-way-in-opposing-donald-trumps-travel-ban/?mcubz=0,0
Donald Trump's travel ban feels like it's 'keeping us safe' from an ...,http://nytlive.nytimes.com/womenintheworld/2017/01/30/donald-trumps-travel-ban-feels-like-its-keeping-us-safe-from-an-invented-threat/?mcubz=0,0
Trump administration's 1st military raid results in death of 8-year-old ...,http://nytlive.nytimes.com/womenintheworld/2017/01/31/trump-administrations-1st-military-raid-results-in-death-of-8-year-old-american-girl/?mcubz=0,0
Man says his elderly mom died in Iraq after being barred from entering ...,http://nytlive.nytimes.com/womenintheworld/2017/02/01/elderly-woman-dies-in-iraq-after-being-barred-from-entering-u-s-by-trump-executive-order/?mcubz=0,0
Angelina Jolie condemns Donald Trump's immigration order – Women ...,http://nytlive.nytimes.com/womenintheworld/2017/02/03/angelina-jolie-condemns-donald-trumps-immigration-order/?mcubz=0,0
Unpacking the travel bans imposed in Libya that are causing an ...,http://nytlive.nytimes.com/womenintheworld/2017/02/24/unpacking-the-travel-bans-imposed-in-libya-that-are-causing-an-uproar-and-threatening-peace-efforts/?mcubz=0,0
22-year-old Somali refugee is reunited with her family following ...,http://nytlive.nytimes.com/womenintheworld/2017/02/26/22-year-old-somali-refugee-is-reunited-with-her-family-following-trumps-travel-ban/?mcubz=0,0
Adam Liptak - The New York Times,http://www.nytimes.com/by/adam-liptak?mcubz=0,0
A 'Commission on Radical Islam' Could Lead to a New McCarthy Era ...,http://www.nytimes.com/roomfordebate/2016/11/18/islam-extremism-and-civil-liberties/a-commission-on-radical-islam-could-lead-to-a-new-mccarthy-era?mcubz=0,0
Appeals Court Will Not Reinstate Trump's Revised Travel Ban - ????,https://cn.nytimes.com/usa/20170526/trump-travel-ban-blocked/en-us/?mcubz=0,0
Trump Loses Travel Ban Ruling in Appeals Court - ??????? ...,https://cn.nytimes.com/usa/20170613/trump-travel-ban-court-of-appeals/en-us/?mcubz=0,0
"Supreme Court Will Hear Travel Ban, Which Is Partly Reinstated - ?? ...",https://cn.nytimes.com/usa/20170627/supreme-court-trump-travel-ban-case/en-us/?mcubz=0,0
Appeals Court Will Not Reinstate Trump's Revised Travel Ban,https://cn.nytimes.com/usa/20170526/trump-travel-ban-blocked/en-us/?mcubz=0,0
Trump Loses Travel Ban Ruling in Appeals Court - ???????,https://cn.nytimes.com/usa/20170613/trump-travel-ban-court-of-appeals/en-us/?mcubz=0,0
Trump's Immigration Ban Is Illegal - NYTimes.com,https://www.nytimes.com/2017/01/27/opinion/trumps-immigration-ban-is-illegal.html?mcubz=0,0
MoMA Protests Trump Entry Ban by Rehanging Work by Artists from ...,https://www.nytimes.com/2017/02/03/arts/design/moma-protests-trump-entry-ban-with-work-by-artists-from-muslim-nations.html?mcubz=0,0
"Ivanka Trump, Alexei Navalny, Travel Ban: Your Morning Briefing ...",https://www.nytimes.com/2017/02/08/briefing/travel-ban-vladimir-putin-carbon-tax.html?mcubz=0,0
"Court Refuses to Reinstate Travel Ban, Dealing Trump Another Legal ...",https://www.nytimes.com/2017/02/09/us/politics/appeals-court-trump-travel-ban.html?mcubz=0,0
"'Bad Dude'? No, but Deported Anyway - NYTimes.com",https://www.nytimes.com/2017/02/10/opinion/bad-dude-no-but-deported-anyway.html?mcubz=0,0
Trump Says Refugees Are Flooding U.S. in Misleading Allusion ...,https://www.nytimes.com/2017/02/11/us/politics/refugees-donald-trump-syria.html?mcubz=0,0
Fact-Checking Claims About Trump's Travel Ban - NYTimes.com,https://www.nytimes.com/2017/02/23/us/politics/fact-checking-claims-about-trumps-travel-ban.html?mcubz=0,0
Trump Expected to Issue New Travel Ban Excluding Iraq on Monday ...,https://www.nytimes.com/2017/03/05/us/politics/trump-expected-to-issue-new-travel-ban-excluding-iraq-on-monday.html?mcubz=0,0
"'I'll Criticize Judges,' Trump Says, Hours After a Scolding for Doing Just ...",https://www.nytimes.com/2017/03/21/us/politics/trump-gorsuch-criticizing-judges.html?mcubz=0,0
Travel Ban Threatens a Lincoln Center Festival Play - NYTimes.com,https://www.nytimes.com/2017/03/22/theater/travel-ban-threatens-a-lincoln-center-festival-play.html?mcubz=0,0
Jeff Sessions Dismisses Hawaii as 'an Island in the Pacific' - NYTimes ...,https://www.nytimes.com/2017/04/20/us/politics/jeff-sessions-judge-hawaii-pacific-island.html?mcubz=0,0
Trump Grows Discontented With Attorney General Jeff Sessions ...,https://www.nytimes.com/2017/06/05/us/politics/trump-discontent-attorney-general-jeff-sessions.html?mcubz=0,0
Donald Trump Is Never to Blame - NYTimes.com,https://www.nytimes.com/2017/06/07/opinion/donald-trump-jeff-sessions-sean-spicer.html?mcubz=0,0
Congress Steps Up on Foreign Policy - NYTimes.com,https://www.nytimes.com/2017/06/22/opinion/congress-nato-trump.html?mcubz=0,0
"Stepsister, Yes; Grandma, No: U.S. Sets Guidelines for Revised Travel ...",https://www.nytimes.com/2017/06/28/us/politics/homeland-security-prepares-to-issue-travel-restrictions.html?mcubz=0,0
Emirates and Turkish Airlines Say Laptop Ban Is Lifted on Their U.S. ...,https://www.nytimes.com/2017/07/05/world/middleeast/laptop-ban-emirates-turkey.html?mcubz=0,0
"Sebastian Gorka Is Forced Out as White House Adviser, Officials Say ...",https://www.nytimes.com/2017/08/25/us/politics/sebastian-gorka-leaves-white-house.html?mcubz=0,0
"Uber Chooses Expedia's Chief as C.E.O., Ending Contentious Search ...",https://www.nytimes.com/2017/08/27/technology/uber-ceo-search.html?mcubz=0,0
Transcript of Donald Trump's Immigration Speech - The New York Times,https://www.nytimes.com/2016/09/02/us/politics/transcript-trump-immigration-speech.html?mcubz=0,0
Muslim Gathering Laments a 'Normalization of Bigotry' - The New York ...,https://www.nytimes.com/2016/09/05/us/politics/muslim-gathering-laments-a-normalization-of-bigotry.html?mcubz=0,0
"Pauline Hanson, Australian Senator, Urges End to Muslim Immigration ...",https://www.nytimes.com/2016/09/16/world/australia/pauline-hanson-muslims-senate.html?mcubz=0,0
Hate Crimes Against American Muslims Most Since Post-9/11 Era ...,https://www.nytimes.com/2016/09/18/us/politics/hate-crimes-american-muslims-rise.html?mcubz=0,0
Mike Pence Disavows Donald Trump's Earlier Proposal Barring Muslims,https://www.nytimes.com/2016/10/07/us/politics/mike-pence-donald-trump-muslim-ban.html?mcubz=0,0
Transcript of the Second Debate - The New York Times,https://www.nytimes.com/2016/10/10/us/politics/transcript-second-debate.html?mcubz=0,0
I Had a Scary Dream About Donald Trump': Muslim Parents Face a …,https://www.nytimes.com/2016/10/26/nyregion/muslims-parents-donald-trump-staten-island.html?mcubz=0,0
'I Had a Scary Dream About Donald Trump': Muslim Parents Face a ...,https://www.nytimes.com/2016/10/26/nyregion/muslims-parents-donald-trump-staten-island.html?mcubz=0,0
What Impact Will Trump Have on Tourism? - The New York Times,https://www.nytimes.com/2016/11/10/travel/trump-travel-tourism.html?mcubz=0,0
"Donald Trump Win Has Blacks, Hispanics and Muslims Bracing for a ...",https://www.nytimes.com/2016/11/10/us/donald-trump-blacks-hispanics-muslims.html?mcubz=0,0
'Strange New Land': America in a Time of Trump - The New York Times,https://www.nytimes.com/2016/11/10/us/politics/donald-trump-presidential-agenda.html?mcubz=0,0
Donald Trump's Long To-Do List for Day 1 - The New York Times,https://www.nytimes.com/2016/11/14/us/politics/donald-trumps-long-to-do-list-for-day-1.html?mcubz=0,0
Germany Bans 'True Religion' Muslim Group and Raids Mosques ...,https://www.nytimes.com/2016/11/16/world/europe/germany-bans-true-religion-islamist-group-and-raids-mosques.html?mcubz=0,0
Trump Camp's Talk of Registry and Japanese Internment Raises ...,https://www.nytimes.com/2016/11/18/us/politics/japanese-internment-muslim-registry.html?mcubz=0,0
"Michael Flynn, Anti-Islamist Ex-General, Offered Security Post, Trump ...",https://www.nytimes.com/2016/11/18/us/politics/michael-flynn-national-security-adviser-donald-trump.html?mcubz=0,0
"As Trump Nears Office, Australian Deal to Move Refugees to U.S. Is in ...",https://www.nytimes.com/2016/11/18/world/australia/australia-us-refugee-deal.html?mcubz=0,0
Muslim Americans Speak of Escalating Worries - The New York Times,https://www.nytimes.com/2016/11/19/us/muslim-americans-speak-of-escalating-worries.html?mcubz=0,0
"With National Security Choices, Trump Builds Team to Bulldoze Status ...",https://www.nytimes.com/2016/11/19/us/politics/flynn-sessions-trump-administration.html?mcubz=0,0
"Jeff Sessions, as Attorney General, Could Overhaul Department He's ...",https://www.nytimes.com/2016/11/19/us/politics/jeff-sessions-donald-trump-attorney-general.html?mcubz=0,0
Mayor de Blasio Vows to Shield New Yorkers From Trump's Policies ...,https://www.nytimes.com/2016/11/21/nyregion/mayor-de-blasio-vows-to-shield-new-yorkers-from-trumps-policies.html?mcubz=0,0
Why Korematsu Is Not a Precedent - The New York Times,https://www.nytimes.com/2016/11/21/opinion/why-korematsu-is-not-a-precedent.html?mcubz=0,0
"Trump, on YouTube, Pledges to Create Jobs - The New York Times",https://www.nytimes.com/2016/11/21/us/politics/donald-trump-presidency.html?mcubz=0,0
Trump's Next Battle: Keeping These Republican Senators Happy - The ...,https://www.nytimes.com/2016/11/26/us/politics/donald-trumps-republicans-senate.html?mcubz=0,0
Delta Air Lines Bans Disruptive Donald Trump Supporter for Life - The ...,https://www.nytimes.com/2016/11/28/business/delta-air-lines-bans-trump-supporter-for-life-after-rude-remarks.html?mcubz=0,0
"Both Feeling Threatened, American Muslims and Jews Join Hands ...",https://www.nytimes.com/2016/12/05/us/muslim-jewish-alliance-after-trump.html?mcubz=0,0
Angela Merkel Calls for Ban on Full-Face Veils in Germany - The New ...,https://www.nytimes.com/2016/12/06/world/europe/merkel-calls-for-ban-on-full-face-veils-in-germany.html?mcubz=0,0
Trump Suggests Berlin Attack Affirms His Plan to Bar Muslims - The ...,https://www.nytimes.com/2016/12/21/us/politics/donald-trump-syria-policy.html?mcubz=0,0
Obama to Dismantle Visitor Registry Before Trump Can Revive It - The ...,https://www.nytimes.com/2016/12/22/nyregion/obama-to-dismantle-visitor-registry-before-trump-can-revive-it.html?mcubz=0,0
Jeff Sessions Says He Would Be Independent and Stand Up to Trump ...,https://www.nytimes.com/2017/01/10/us/politics/jeff-sessions-attorney-general.html?mcubz=0,0
Hearing Highlights: Sessions Questioned on Links to Xenophobia ...,https://www.nytimes.com/2017/01/10/us/politics/trump-confirmation-hearings.html?mcubz=0,0
Muslim Girls in Switzerland Must Attend Swim Classes With Boys ...,https://www.nytimes.com/2017/01/10/world/europe/swiss-muslim-girls-must-attend-swim-classes-with-boys-court-says.html?mcubz=0,0
Latest to Disagree With Donald Trump: His Cabinet Nominees - The ...,https://www.nytimes.com/2017/01/12/us/politics/trump-cabinet-mattis-tillerson.html?mcubz=0,0
Trump to Order Mexican Border Wall and Curtail Immigration - The ...,https://www.nytimes.com/2017/01/24/us/politics/wall-border-trump.html?mcubz=0,0
Dutch Leader Takes Trump-Like Turn in Face of Hard-Right Challenge ...,https://www.nytimes.com/2017/01/24/world/europe/mark-rutte-netherlands-muslim-immigrants-trump.html?mcubz=0,0
'Sanctuary City' Mayors Vow to Defy Trump's Immigration Order - The ...,https://www.nytimes.com/2017/01/25/nyregion/outraged-mayors-vow-to-defy-trumps-immigration-order.html?mcubz=0,0
Trump Poised to Lift Ban on C.I.A. 'Black Site' Prisons - The New York ...,https://www.nytimes.com/2017/01/25/us/politics/cia-detainee-prisons.html?mcubz=0,0
Trump Orders Mexican Border Wall to Be Built and Plans to Block ...,https://www.nytimes.com/2017/01/25/us/politics/refugees-immigrants-wall-trump.html?mcubz=0,0
Star of Iranian Film Says She Will Boycott Oscars Over Trump's Visa Ban,https://www.nytimes.com/2017/01/26/movies/taraneh-alidoosti-boycott-oscars-trump-iranian-film.html?mcubz=0,0
"Even Before Trump Acts on Immigration, New Yorkers Protest - The ...",https://www.nytimes.com/2017/01/26/nyregion/new-york-protest-trump-immigration-orders.html?mcubz=0,0
'I Think Islam Hates Us' - The New York Times,https://www.nytimes.com/2017/01/26/opinion/i-think-islam-hates-us.html?mcubz=0,0
Texas Muslims Voice Concerns After Inflammatory Survey and Forum ...,https://www.nytimes.com/2017/01/26/us/texas-muslim-community.html?mcubz=0,0
Donald Trump's Un-American Refugee Policy - The New York Times,https://www.nytimes.com/2017/01/27/opinion/donald-trumps-un-american-refugee-policy.html?mcubz=0,0
The Closing of Trump's America - The New York Times,https://www.nytimes.com/2017/01/27/opinion/the-closing-of-trumps-america.html?mcubz=0,0
Trump's Immigration Ban Is Illegal - The New York Times,https://www.nytimes.com/2017/01/27/opinion/trumps-immigration-ban-is-illegal.html?mcubz=0,0
Full Executive Order Text: Trump's Action Limiting Refugees Into the ...,https://www.nytimes.com/2017/01/27/us/politics/refugee-muslim-executive-order-trump.html?mcubz=0,0
Trump Bars Refugees and Citizens of 7 Muslim Countries - The New ...,https://www.nytimes.com/2017/01/27/us/politics/trump-syrian-refugees.html?mcubz=0,0
Fears That Trump's Visa Ban Betrays Friends and Bolsters Enemies ...,https://www.nytimes.com/2017/01/27/world/middleeast/muslims-trump-visa-restrictions-.html?mcubz=0,0
"In Iran, Shock and Bewilderment Over Trump Visa Crackdown - The ...",https://www.nytimes.com/2017/01/27/world/middleeast/trump-visa-muslim-ban.html?mcubz=0,0
Trump's Visa Ban May Keep Nominated Iranian Director From ...,https://www.nytimes.com/2017/01/28/arts/trump-muslim-ban-oscars-iranian-director.html?mcubz=0,0
Protest Grows 'Out of Nowhere' at Kennedy Airport After Iraqis Are ...,https://www.nytimes.com/2017/01/28/nyregion/jfk-protests-trump-refugee-ban.html?mcubz=0,0
Donald Trump's Muslim Ban Is Cowardly and Dangerous - The New ...,https://www.nytimes.com/2017/01/28/opinion/donald-trumps-muslim-ban-is-cowardly-and-dangerous.html?mcubz=0,0
"President Trump, Meet My Family - The New York Times",https://www.nytimes.com/2017/01/28/opinion/sunday/president-trump-meet-my-family.html?mcubz=0,0
Trump's Immigration Order Could Have a Big Impact on Sports - The ...,https://www.nytimes.com/2017/01/28/sports/trump-refugee-ban.html?mcubz=0,0
Anxiety About Muslim Refugees Is Stoked Online by the Far-Right Media,https://www.nytimes.com/2017/01/28/us/anxiety-about-muslim-refugees-is-stoked-online-by-the-far-right-media.html?mcubz=0,0
Fire Destroys Mosque in Texas in Early Hours - The New York Times,https://www.nytimes.com/2017/01/28/us/fire-destroys-mosque-in-texas-in-early-hours.html?mcubz=0,0
"Iraqi Immigrant, Caught in a Trump Policy Tangle, Is Allowed to Stay ...",https://www.nytimes.com/2017/01/28/us/iraqi-immigrant-donald-trump-airport-detention.html?mcubz=0,0
"President Trump's Immigration Order, Annotated - The New York Times",https://www.nytimes.com/2017/01/28/us/politics/annotating-trump-immigration-refugee-order.html?mcubz=0,0
"Immigration Ban Is Unlikely to Reduce Terrorist Threat, Experts Say ...",https://www.nytimes.com/2017/01/28/us/politics/a-sweeping-order-unlikely-to-reduce-terrorist-threat.html?mcubz=0,0
Trump's Signing of Immigrant Ban Puts Pentagon in Uncomfortable ...,https://www.nytimes.com/2017/01/28/us/politics/trump-immigration-ban-muslims-military.html?mcubz=0,0
Trump Toughens Some Facets of Lobbying Ban and Weakens Others ...,https://www.nytimes.com/2017/01/28/us/politics/trump-toughens-some-facets-of-lobbying-ban-and-weakens-others.html?mcubz=0,0
Refugee Ban Injects Chaos Into Iraqi Family's Reunion - The New ...,https://www.nytimes.com/2017/01/28/us/refugee-ban-injects-chaos-into-iraqi-familys-reunion.html?mcubz=0,0
Judge Blocks Trump Order on Refugees Amid Chaos and Outcry ...,https://www.nytimes.com/2017/01/28/us/refugees-detained-at-us-airports-prompting-legal-challenges-to-trumps-immigration-order.html?mcubz=0,0
Warm Welcome for Syrians in a Country About to Ban Them - The New ...,https://www.nytimes.com/2017/01/28/us/refugees-syria-trump.html?mcubz=0,0
Trump's Immigration Ban Draws Deep Anger and Muted Praise - The ...,https://www.nytimes.com/2017/01/28/us/trumps-immigration-ban-disapproval-applause.html?mcubz=0,0
Banned From U.S.: 'You Need to Go Back to Your Country' - The New ...,https://www.nytimes.com/2017/01/28/us/us-immigration-ban.html?mcubz=0,0
"In Canada, Justin Trudeau Says Refugees Are Welcome - The New ...",https://www.nytimes.com/2017/01/28/world/canada/justin-trudeau-trump-refugee-ban.html?mcubz=0,0
'Dreams Die' for Refugees on Verge of Coming to U.S. as Trump ...,https://www.nytimes.com/2017/01/28/world/middleeast/trump-middle-east-refugees-ban.html?mcubz=0,0
Executives' Response to Immigration Order Runs Gamut From Caution ...,https://www.nytimes.com/2017/01/29/business/immigration-travel-ban-businesses.html?mcubz=0,0
Analyzing Trump's Immigration Ban: A Lesson Plan - The New York ...,https://www.nytimes.com/2017/01/29/learning/lesson-plans/analyzing-trumps-immigration-ban-a-lesson-plan.html?mcubz=0,0
Iranian Director Asghar Farhadi Won't Attend Oscar Ceremony - The ...,https://www.nytimes.com/2017/01/29/movies/trump-immigration-oscars-iranian-director-asghar-farhadi.html?mcubz=0,0
"Visa Ban Leaves Artists in Limbo, and Institutions Perplexed - The ...",https://www.nytimes.com/2017/01/29/movies/visa-ban-leaves-artists-in-limbo-and-institutions-perplexed.html?mcubz=0,0
Refugee Ban Endangers 'Part of American Legacy' - The New York ...,https://www.nytimes.com/2017/01/29/nyregion/donald-trump-refugee-ban-american-legacy.html?mcubz=0,0
Highlights: Reaction to Trump's Travel Ban - The New York Times,https://www.nytimes.com/2017/01/29/nyregion/trump-travel-ban-protests-briefing.html?mcubz=0,0
"Allies in Combat, Now Unwanted - The New York Times",https://www.nytimes.com/2017/01/29/opinion/allies-in-combat-now-unwanted.html?mcubz=0,0
The Outcry Over Trump's Refugee Ban - The New York Times,https://www.nytimes.com/2017/01/29/opinion/the-outcry-over-trumps-refugee-ban.html?mcubz=0,0
Who Hasn't Trump Banned? People From Places Where He's Done ...,https://www.nytimes.com/2017/01/29/opinion/who-hasnt-trump-banned-people-from-places-where-hes-made-money.html?mcubz=0,0
Silicon Valley's Ambivalence Toward Trump Turns to Anger - The New ...,https://www.nytimes.com/2017/01/29/technology/silicon-valleys-ambivalence-toward-trump-turns-to-anger.html?mcubz=0,0
Immigration Ban Prompts Fee Waivers and Refunds From Airlines ...,https://www.nytimes.com/2017/01/29/travel/trump-ban-airlines.html?mcubz=0,0
Christian leaders denounce Trump's plan to favor Christian refugees,https://www.nytimes.com/2017/01/29/us/christian-leaders-denounce-trumps-plan-to-favor-christian-immigrants.html?mcubz=0,0
Judge Who Blocked Trump's Refugee Order Praised for 'Firm Moral ...,https://www.nytimes.com/2017/01/29/us/judge-trump-refugee-order-ann-donnelly.html?mcubz=0,0
Lawyers Mobilize at Nation's Airports After Trump's Order - The New ...,https://www.nytimes.com/2017/01/29/us/lawyers-trump-muslim-ban-immigration.html?mcubz=0,0
"Trump's Immigration Order Jolts Iraqis, U.S.'s Top Allies Against ISIS ...",https://www.nytimes.com/2017/01/29/us/politics/donald-trump-immigration-order-iraq.html?mcubz=0,0
How Trump's Rush to Enact an Immigration Ban Unleashed Global ...,https://www.nytimes.com/2017/01/29/us/politics/donald-trump-rush-immigration-order-chaos.html?mcubz=0,0
Growing Number of GOP Lawmakers Criticize Trump's Refugee Policy,https://www.nytimes.com/2017/01/29/us/politics/republicans-congress-trump-refugees.html?mcubz=0,0
Rulings on Trump's Immigration Order Are First Step on a Long Legal ...,https://www.nytimes.com/2017/01/29/us/politics/trump-immigration-refugee-order.html?mcubz=0,0
Travelers Stranded and Protests Swell Over Trump Order - The New ...,https://www.nytimes.com/2017/01/29/us/politics/white-house-official-in-reversal-says-green-card-holders-wont-be-barred.html?mcubz=0,0
"Demonstrators in Streets, and at Airports, Protest Immigration Order ...",https://www.nytimes.com/2017/01/29/us/protests-airports-donald-trump-immigration-executive-order-muslims.html?mcubz=0,0
Bannon Is Given Security Role Usually Held for Generals - The New ...,https://www.nytimes.com/2017/01/29/us/stephen-bannon-donald-trump-national-security-council.html?mcubz=0,0
Trump's Executive Order on Immigration: What We Know and What We ...,https://www.nytimes.com/2017/01/29/us/trump-refugee-ban-muslim-executive-order.html?mcubz=0,0
European Leaders Reject Trump's Refugee Ban as Violating Principles,https://www.nytimes.com/2017/01/29/world/europe/trump-executive-order-europe-merkel.html?mcubz=0,0
"In Face of Trump's Order, Some Muslim Nations Are Conspicuously ...",https://www.nytimes.com/2017/01/29/world/middleeast/donald-trump-muslims-reaction.html?mcubz=0,0
Frantic Phoning Among C.E.O.s: How to Address Trump Ban? - The ...,https://www.nytimes.com/2017/01/30/business/dealbook/ceo-response-trump-ban.html?mcubz=0,0
"Wall Street Reassures Employees, Without Wholly Rejecting Travel ...",https://www.nytimes.com/2017/01/30/business/dealbook/wall-street-trump-muslim-ban.html?mcubz=0,0
Diplomats Decry Muslim Ban - The New York Times,https://www.nytimes.com/2017/01/30/opinion/diplomats-decry-muslim-ban.html?mcubz=0,0
Disorder and the Immigration Order - The New York Times,https://www.nytimes.com/2017/01/30/opinion/disorder-and-the-immigration-order.html?mcubz=0,0
"No, Trump, Not on Our Watch - The New York Times",https://www.nytimes.com/2017/01/30/opinion/no-trump-not-on-our-watch.html?mcubz=0,0
President Bannon? - The New York Times,https://www.nytimes.com/2017/01/30/opinion/president-bannon.html?mcubz=0,0
"Science Will Suffer Under Trump's Travel Ban, Researchers Say - The ...",https://www.nytimes.com/2017/01/30/science/scientists-donald-trump-travel-ban.html?mcubz=0,0
U.S. Wrestlers Plan to Compete in Iran Amid Travel Ban - The New ...,https://www.nytimes.com/2017/01/30/sports/travel-ban-us-wrestlers-iran.html?mcubz=0,0
Tech Companies Fight Trump Immigration Order in Court - The New ...,https://www.nytimes.com/2017/01/30/technology/technology-companies-fight-trump-immigration-order-in-court.html?mcubz=0,0
Republicans Have One Big Incentive to Stick With Trump - The New ...,https://www.nytimes.com/2017/01/30/upshot/republicans-have-one-big-incentive-to-stick-with-trump.html?mcubz=0,0
Donations to A.C.L.U. and Other Organizations Surge After Trump's ...,https://www.nytimes.com/2017/01/30/us/aclu-fund-raising-trump-travel-ban.html?mcubz=0,0
California Today: Airports a Flashpoint in Immigration Protests - The ...,https://www.nytimes.com/2017/01/30/us/california-today-airport-protests.html?mcubz=0,0
Where Immigrants From Banned Nations Live in the U.S. - The New ...,https://www.nytimes.com/2017/01/30/us/immigration-ban-locations.html?mcubz=0,0
"He Was Sent Back to Iran. Now, a Court Says the US Must Readmit Him.",https://www.nytimes.com/2017/01/30/us/iran-brothers-travel-ban-ali-vayeghan.html?mcubz=0,0
Legal Challenges Mount Against Trump's Travel Ban - The New York ...,https://www.nytimes.com/2017/01/30/us/legal-challenges-mount-against-trumps-travel-ban.html?mcubz=0,0
"In Ban on Migrants, Trump Supporters See a Promise Kept - The New ...",https://www.nytimes.com/2017/01/30/us/migrants-ban-trump-supporters.html?mcubz=0,0
"Migrants Were Told to Sign Away Right to Enter U.S., Lawyers Say ...",https://www.nytimes.com/2017/01/30/us/migrants-documents-travel-ban.html?mcubz=0,0
"Obama Speaks Up, Praising Protests and Opposing Religious Test ...",https://www.nytimes.com/2017/01/30/us/politics/donald-trump-administration.html?mcubz=0,0
Liberal Lawyers Plan Wave of Resistance to Trump Policies - The New ...,https://www.nytimes.com/2017/01/30/us/politics/lawyers-trump-travel-order.html?mcubz=0,0
"Obama, Out of Office 10 Days, Speaks Out Against Immigration Ban ...",https://www.nytimes.com/2017/01/30/us/politics/obama-trump-immigration-ban.html?mcubz=0,0
Trump Fires Acting Attorney General Who Defied Him - The New York ...,https://www.nytimes.com/2017/01/30/us/politics/trump-immigration-ban-memo.html?mcubz=0,0
Trump's Immigration Order Tests Limits of Law and Executive Power ...,https://www.nytimes.com/2017/01/30/us/politics/trump-immigration-muslim-ban.html?mcubz=0,0
Trump Supporters Applaud Immigration Order as a 'Welcome Change ...,https://www.nytimes.com/2017/01/30/us/trump-travel-ban-republicans-conservatives.html?mcubz=0,0
Australia Says Trump Will Honor One-Time Deal to Accept Refugees ...,https://www.nytimes.com/2017/01/30/world/australia/trump-us-refugee-manus-nauru.html?mcubz=0,0
"'You Have Let Us Down, Trump': Iraqis See U.S. Relations Recast ...",https://www.nytimes.com/2017/01/30/world/middleeast/iraq-trump-refugee-ban.html?mcubz=0,0
"In Trump's Early Days, News Media Finds Competing Narratives - The ...",https://www.nytimes.com/2017/01/31/business/trump-news-media.html?mcubz=0,0
The Abnormal Presidency of Donald Trump - The New York Times,https://www.nytimes.com/2017/01/31/opinion/the-abnormal-presidency-of-donald-trump.html?mcubz=0,0
The Fallout From the Immigration Ban - The New York Times,https://www.nytimes.com/2017/01/31/opinion/the-fallout-from-the-immigration-ban.html?mcubz=0,0
Expedia Supports Lawsuit Against Trump's Immigration Ban - The ...,https://www.nytimes.com/2017/01/31/travel/expedia-dara-khosrowshahi-lawsuit-against-trump-immigration-ban.html?mcubz=0,0
"It's 'The Apprentice, Supreme Court Edition,' as Trump Summons ...",https://www.nytimes.com/2017/01/31/us/politics/donald-trump-administration.html?mcubz=0,0
